{"$schema":"https://json-schema.org/draft/2020-12/schema","$id":"magic.scope/v1","type":"object","additionalProperties":false,"required":["schema","source","members","member_count","immutable","scope_hash"],"properties":{"schema":{"const":"magic.scope/v1"},"source":{"type":"object"},"members":{"type":"array","items":{"type":"object","required":["oracle_face_key","oracle_face_id","semantic_revision_hash","quarantine_status","relation_readiness","assertion_locators"]}},"member_count":{"type":"integer","minimum":1},"immutable":{"const":true},"scope_hash":{"pattern":"^sha256:[0-9a-f]{64}$"}}}
