{"immutable":true,"member_count":2,"members":[{"assertion_locators":[{"assertion_index":2,"exact_text":"Target player draws two cards.","span":{"end":30,"start":0}}],"oracle_face_id":"oracle:59b869b9-cb48-4152-ad91-52f582e2df5b:none","oracle_face_key":{"scryfallOracleId":"59b869b9-cb48-4152-ad91-52f582e2df5b","side":null},"quarantine_status":"clear","relation_readiness":"not_required","semantic_revision_hash":"sha256:0d229efca9e3f46e630c0cc1c965a1e51196f8cd25335db493ab0197e835b4a7"},{"assertion_locators":[{"assertion_index":1,"exact_text":"Target player draws two cards.","span":{"end":30,"start":0}}],"oracle_face_id":"oracle:8f32ceb2-92c2-4dde-bf73-40bb79c3fcef:none","oracle_face_key":{"scryfallOracleId":"8f32ceb2-92c2-4dde-bf73-40bb79c3fcef","side":null},"quarantine_status":"clear","relation_readiness":"not_required","semantic_revision_hash":"sha256:48378999ea33d96838f596041f42f35ad402c3a4c9c8be18cdf8fecb08c5c2a7"}],"schema":"magic.scope/v1","scope_hash":"sha256:250073aa06bf5b0e04f3faf9c912154521743ca7469454eff9e1c45ab3b78a11","source":{"adapter_hash":"sha256:0fb97fbbe6cc0866acbbce0867eb6f1c10a9c1cc48c1c92cba0dd5ea7b6c53aa","analyzer_hash":"sha256:5ba883bf5cf6f06719b4636e3f4c99cd1112624933adea420b05c02b13d19663","oracle_inventory_hash":"sha256:8cdd0282d959a4039ceaa5e462c9214b3e95f15de9b9880373bda04f5fbef629","policy_hash":"sha256:0811b3eda7e5a30edec42582c5c2661c12121217d0a68db9ad30e245111e8aeb","projection_hash":"sha256:6e0896fdafbf6c331995bc3053a4445729712eeac10f74d1739d869fa549e140","skill_hash":"sha256:9d9756fa6a5e24c49730c23bbe2494dd6f56db297cfda8c1e492b2cb1ff824e6","source_snapshot_hash":"sha256:a8b9d4ef356186746f0754142c8c8d24d7f80528bc3c0ffee77457040ee0c7c9"}}
